{
  "schema_version": "2",
  "manifest_id": "jacobian.public_postdoc.status",
  "manifest_version": "2",
  "title": "Current Jacobian portfolio status and four-domain capability gates for public postdoc v1",
  "purpose": "CURRENT_PORTFOLIO_STATUS_AND_PUBLIC_EVALUATION",
  "evaluation_class": "PUBLIC_ANSWER_VISIBLE_DIAGNOSTIC",
  "scored": false,
  "captured_at": "2026-07-29",
  "source_suite": {
    "path": "benchmarks/research_challenges/public_postdoc_v1.json",
    "sha256": "sha256:cb025baf444d4a21482f4582afac066bb515aded105fd380cbd10ec4b78483ec",
    "snapshot_semantics": "IMMUTABLE_HISTORICAL_INPUT"
  },
  "portfolio_snapshot": {
    "repository_commit": "081834c979ec8f1c3b3995ebb86908bd82333a07",
    "snapshot_basis": "PRE_MANIFEST_ENVIRONMENT_AT_REPOSITORY_COMMIT",
    "catalog_version": "1",
    "catalog_digest": "sha256:50dbb1584ffd1780498edcd61e2d858b253e13ff03e8635661e8f31468c37af6",
    "capability_count": 269,
    "policy_profile": "DEFAULT",
    "policy_digest": "sha256:870a92b83d3e522e4015b6bb1cabda33086906f9de1c3c36e466251ea7ed1957",
    "captured_at": "2026-07-29"
  },
  "evaluation_portfolio_snapshot": {
    "repository_commit": "081834c979ec8f1c3b3995ebb86908bd82333a07",
    "snapshot_basis": "PRE_MANIFEST_ENVIRONMENT_AT_REPOSITORY_COMMIT",
    "catalog_version": "1",
    "catalog_digest": "sha256:22343c82df3655e8f7b69bd9c70e05dd83d703f42ea7fa57cf61a43602ca25cb",
    "capability_count": 266,
    "policy_profile": "COMPUTE_VERIFY_NO_RETRIEVAL",
    "policy_digest": "sha256:3c8655dcbcecf1965b7727a9333e0f6905b5e1dc7b1e750bd9840223292acddf",
    "captured_at": "2026-07-29"
  },
  "evaluation_protocol": {
    "runner": "benchmarks/research_challenge.py",
    "prompt_handling": "PASS_PUBLISHED_PROMPT_UNCHANGED",
    "source_urls_withheld": true,
    "capability_policy_profile": "COMPUTE_VERIFY_NO_RETRIEVAL",
    "retrieval_capabilities_available": false,
    "minimum_repetitions_for_comparison": 3,
    "false_certification_first": true,
    "held_out_claims_allowed": false
  },
  "move_ledger": [
    {
      "episode_id": "finite-rational-distribution-transform-foundation",
      "source": "Current finite raw-moment contract, public cases jcb-postdoc-005 and jcb-postdoc-011, and maintained exact-rational probability systems",
      "mathematical_move": "Select an event, renormalize on that event, map atoms, or combine two independent finite rational variables while retaining every exact mass contribution.",
      "required_input": "One or two normalized finite rational distributions plus an explicit finite event or total lookup map.",
      "output_artifact": "A bound exact probability or normalized finite rational distribution with a canonical contribution ledger.",
      "trust_boundary": "A producer may use python-flint, while an operator-authorized checker independently replays every contribution with standard-library rational arithmetic.",
      "recurrence_signal": "Exact finite-distribution transformations are fundamental primitives shared by conditional expectation, finite Markov, reliability, and public Gaussian/percolation diagnostics; the catalog currently exposes only one raw moment.",
      "candidate_ids": [
        "roadmap.finite-rational-distribution-transforms"
      ],
      "disposition": "SPLIT"
    },
    {
      "episode_id": "finite-poset-certificate-foundation",
      "source": "Maintained NetworkX DAG operations, Sage finite-poset contracts, and current graph/finite-set portfolio gaps",
      "mathematical_move": "Materialize a finite partial order and compute an extremal or incidence outcome while preserving Hasse, closure, antichain, chain-cover, or recurrence evidence.",
      "required_input": "A bounded labelled finite carrier and either cover relations or comparable pairs under an explicit interpretation.",
      "output_artifact": "A canonical finite-poset artifact and one separately inspectable width, linear-extension-count, or Möbius-function result.",
      "trust_boundary": "NetworkX may produce DAG and matching results, while independent closure, chain/antichain, recurrence, and Möbius replay binds the exact poset.",
      "recurrence_signal": "Finite posets are a fundamental discrete structure with downstream order, lattice, incidence, scheduling, and extremal-combinatorics leverage; no poset-owned capability exists.",
      "candidate_ids": [
        "roadmap.finite-poset-foundation"
      ],
      "disposition": "PROMOTED"
    },
    {
      "episode_id": "exact-planar-degeneracy-foundation",
      "source": "Current exact-rational geometry bundle, exact-kernel documentation, and the public unit-distance construction workflow",
      "mathematical_move": "Classify exact intersections and closed-set membership while preserving endpoint, overlap, boundary, and invalid-polygon distinctions.",
      "required_input": "Bounded rational line segments, polygon rings, or a rational query point.",
      "output_artifact": "A discriminated segment-intersection, polygon-simplicity, or inside-boundary-outside result with determinant evidence.",
      "trust_boundary": "The producer may reuse SymPy exact rationals, while an independent Fraction-based checker replays determinants, interval containment, and all required edge pairs.",
      "recurrence_signal": "Exact degeneracy handling recurs throughout the existing geometry portfolio and public exact-coordinate constructions; current line and convex-hull operations do not expose segment overlap or polygon membership.",
      "candidate_ids": [
        "roadmap.exact-planar-geometry-foundation"
      ],
      "disposition": "PROMOTED"
    },
    {
      "episode_id": "finite-simplicial-homology-foundation",
      "source": "Maintained finite-simplicial-complex systems and the absence of topology-owned artifacts in the current catalog",
      "mathematical_move": "Close a finite facet list under faces, orient its boundary matrices, and compute homology over one bounded prime field.",
      "required_input": "A bounded finite facet list, canonical vertex labels, an explicit reduced/unreduced convention, and a prime coefficient field.",
      "output_artifact": "A canonical simplicial complex, chain complex, and separately inspectable finite-field homology basis with cycle and rank evidence.",
      "trust_boundary": "A producer may use maintained linear algebra, while an independent modular checker reconstructs faces and boundaries, verifies boundary-square-zero, and replays kernel/image quotient obligations.",
      "recurrence_signal": "Finite simplicial complexes and field homology are fundamental topology primitives with clear reuse and strong replay semantics; the catalog has no topology capability.",
      "candidate_ids": [
        "roadmap.finite-simplicial-homology-foundation"
      ],
      "disposition": "SPLIT"
    }
  ],
  "cases": [
    {
      "challenge_id": "jcb-postdoc-001",
      "historical_fit": "DIRECT",
      "current_status": "COVERED",
      "current_capabilities": [
        "polynomial.map.compute_jacobian",
        "polynomial.map.evaluate",
        "polynomial.map.collision.verify"
      ],
      "repository_evidence": [
        "tests/integration/polynomial/test_polynomial_collision_verify.py::test_direct_collision_verifier_promotes_only_independent_replay",
        "tests/integration/polynomial/test_polynomial_collision_verify.py::test_direct_collision_verifier_fails_closed_for_wrong_image"
      ],
      "current_boundary": "The exact map, Jacobian, images, and collision have a domain-owned independent replay path; the public mathematical construction remains answer-visible and is not a held-out performance result.",
      "evaluation_status": "REGRESSION_COVERED",
      "next_action": "Keep the public collision as a no-retrieval regression and preserve producer/checker separation."
    },
    {
      "challenge_id": "jcb-postdoc-002",
      "historical_fit": "DIRECT",
      "current_status": "COVERED",
      "current_capabilities": [
        "graph.construct.compose",
        "graph.hamiltonian_path.decide",
        "graph.hamiltonian_path.verify",
        "graph.induced_tree.maximum.compute",
        "graph.induced_tree.maximum.verify"
      ],
      "repository_evidence": [
        "tests/integration/domains/test_frontier_capabilities.py::test_hamiltonian_path_decision_has_independent_replay",
        "tests/integration/domains/test_frontier_capabilities.py::test_hamiltonian_checker_rejects_a_forged_negative_decision"
      ],
      "current_boundary": "The historical suite correctly recorded the older portfolio, but the current catalog now includes bounded Hamiltonian-path decision and independent replay through order 18, covering the 14-vertex obstruction without rewriting v1.",
      "evaluation_status": "REGRESSION_COVERED",
      "next_action": "Add the exact 14-vertex public object as a stable regression only if its redistribution and fixture size remain appropriate."
    },
    {
      "challenge_id": "jcb-postdoc-003",
      "historical_fit": "DIRECT",
      "current_status": "COVERED",
      "current_capabilities": [
        "universal_algebra.search.countermodel",
        "universal_algebra.evaluate_laws"
      ],
      "repository_evidence": [
        "tests/integration/domains/test_universal_algebra_capabilities.py::test_countermodel_search_composes_with_independent_law_replay",
        "tests/unit/test_research_challenge_corpus.py::test_magma_implication_oracle_replays_the_minimal_order_two_model"
      ],
      "current_boundary": "The bounded countermodel search and separate exact law evaluation expose the decisive model while retaining finite-scope semantics.",
      "evaluation_status": "REGRESSION_COVERED",
      "next_action": "Keep the order-two oracle and bounded no-witness behavior as separate regression obligations."
    },
    {
      "challenge_id": "jcb-postdoc-004",
      "historical_fit": "PARTIAL",
      "current_status": "PARTIAL",